{
  "studyBooks": [
    { "id": "sevcik_op1_1", "title": "School of Violin Technics, Op.1 Part 1", "composer": "Otakar Ševčík", "difficulty": "Iniciante", "type": "tecnica" },
    { "id": "sevcik_op2", "title": "School of Bowing Technics, Op.2", "composer": "Otakar Ševčík", "difficulty": "Iniciante", "type": "tecnica" },
    { "id": "sevcik_op3", "title": "Shifting (Mudanças de Posição), Op.3", "composer": "Otakar Ševčík", "difficulty": "Intermedio", "type": "tecnica" },
    { "id": "sevcik_op7", "title": "Preparatory Trill Studies, Op.7", "composer": "Otakar Ševčík", "difficulty": "Solista", "type": "tecnica" },
    { "id": "sevcik_op8", "title": "Shifting (Mudança de Posição), Op.8", "composer": "Otakar Ševčík", "difficulty": "Intermedio", "type": "tecnica" },
    { "id": "sevcik_op9", "title": "Double Stop Preparations, Op.9", "composer": "Otakar Ševčík", "difficulty": "Intermedio", "type": "tecnica" },
    { "id": "kayser_op20", "title": "36 Elementary and Progressive Studies, Op.20", "composer": "Heinrich Ernst Kayser", "difficulty": "Intermedio", "type": "etude" },
    { "id": "wohlfahrt_op45", "title": "60 Studies, Op.45", "composer": "Franz Wohlfahrt", "difficulty": "Iniciante", "type": "etude" },
    { "id": "dont_op35", "title": "24 Studies and Caprices, Op.35", "composer": "Jakob Dont", "difficulty": "Solista", "type": "etude" },
    { "id": "kreutzer_42", "title": "42 Studies or Caprices", "composer": "Rodolphe Kreutzer", "difficulty": "Avancado", "type": "etude" },
    { "id": "fiorillo_36", "title": "36 Etudes or Caprices", "composer": "Federigo Fiorillo", "difficulty": "Avancado", "type": "etude" },
    { "id": "flesch_scale_system", "title": "Scale System", "composer": "Carl Flesch", "difficulty": "Avancado", "type": "escala" },
    { "id": "galamian_scale_system", "title": "Contemporary Violin Technique", "composer": "Ivan Galamian", "difficulty": "Avancado", "type": "escala" },
    { "id": "suzuki_vol1", "title": "Suzuki Violin School, Vol 1", "composer": "Shinichi Suzuki", "difficulty": "Iniciante", "type": "escala" }
  ],
  "studyUnits": [
    {
      "id": "sevcik_unit_g_maj",
      "bookId": "sevcik_op1_1",
      "title": "Ševčík Op.1 Part 1 Ex.17 (Sol Maior)",
      "focus": "Fortalecimento do 4º dedo, flexibilidade do punho no arco e afinação na primeira posição.",
      "notes": ["G4", "A4", "B4", "C5", "D5", "E5", "F#5", "G5", "A5", "G5", "F#5", "E5", "D5", "C5", "B4", "A4", "G4"]
    },
    {
      "id": "sevcik_double_g",
      "bookId": "sevcik_op9",
      "title": "Ševčík Op.9 Ex.1 - Terças e Sextas em Sol",
      "focus": "Afinação e dedilhado de cordas duplas. Dedos 1 e 3, 2 e 4 atuando em pares.",
      "notes": ["G3-B3", "A3-C4", "B3-D4", "C4-E4", "D4-F#4", "E4-G4", "F#4-A4", "G4-B4", "F#4-A4", "E4-G4", "D4-F#4", "C4-E4", "B3-D4", "A3-C4", "G3-B3"]
    },
    {
      "id": "kreutzer_unit_g_maj",
      "bookId": "kreutzer_42",
      "title": "Kreutzer Estudo Nº 35 - Sextas e Oitavas (Sol Maior)",
      "focus": "Montagem de oitavas paralelas e sextas. Apoio igual nos dois pontos do arco.",
      "notes": ["G3-E4", "A3-F#4", "B3-G4", "C4-A4", "D4-B4", "E4-C5", "F#4-D5", "G4-E5", "G3-G4", "A3-A4", "B3-B4", "C4-C5", "G3-E4"]
    },
    {
      "id": "fiorillo_unit_g_maj",
      "bookId": "fiorillo_36",
      "title": "Fiorillo Estudo Nº 12 - Acordes de 3 e 4 cordas",
      "focus": "Ataque simultâneo das cordas. Cotovelo direito alinhado para a divisão do peso.",
      "notes": ["G3-D4-B4", "A3-E4-C5", "B3-F#4-D5", "G3-D4-B4-G5", "B3-F#4-D5", "A3-E4-C5", "G3-D4-B4"]
    },
    {
      "id": "sevcik_unit_d_maj",
      "bookId": "sevcik_op1_1",
      "title": "Ševčík Op.1 Part 1 Ex.18 (Ré Maior)",
      "focus": "Estudo de terças e quintas na 1ª posição com cruzamento de cordas rápido.",
      "notes": ["D4", "F#4", "E4", "G4", "F#4", "A4", "G4", "B4", "A4", "C#5", "B4", "D5", "C#5", "B4", "A4", "G4", "F#4", "E4", "D4"]
    },
    {
      "id": "sevcik_double_d",
      "bookId": "sevcik_op9",
      "title": "Ševčík Op.9 Ex.2 - Terças e Quartas em Ré",
      "focus": "Afinação e montagem de acordes de Ré. 1º e 2º dedos colados.",
      "notes": ["D4-F#4", "E4-G4", "F#4-A4", "G4-B4", "A4-C#5", "B4-D5", "A4-C#5", "G4-B4", "F#4-A4", "E4-G4", "D4-F#4"]
    },
    {
      "id": "kayser_unit_g_maj",
      "bookId": "kayser_op20",
      "title": "Kayser Op.20 Estudo Nº 2 (Sol Maior)",
      "focus": "Desenvolvimento do staccato na metade superior do arco, transição ágil de corda.",
      "notes": ["G4", "B4", "D5", "G5", "F#5", "D5", "B4", "G4", "A4", "C5", "E5", "A5", "G5", "E5", "C5", "A4"]
    },
    {
      "id": "kayser_unit_d_maj",
      "bookId": "kayser_op20",
      "title": "Kayser Op.20 Estudo Nº 5 (Ré Maior)",
      "focus": "Cruzes de corda complexos, mantendo dedilhado firme na primeira posição.",
      "notes": ["D4", "A4", "F#4", "D5", "A4", "F#5", "D5", "A5", "G5", "E5", "C#5", "A4", "D4"]
    },
    {
      "id": "kayser_unit_a_maj",
      "bookId": "kayser_op20",
      "title": "Kayser Op.20 Estudo Nº 7 (Lá Maior)",
      "focus": "Distribuição de arco (Whole Bow / Half Bow) com ligaduras amplas.",
      "notes": ["A4", "E5", "C#5", "A5", "E5", "A5", "G#5", "E5", "D5", "B4", "G#4", "E4", "A4"]
    },
    {
      "id": "suzuki_unit_g_maj",
      "bookId": "suzuki_vol1",
      "title": "Suzuki Vol 1 - Escala de Sol Maior",
      "focus": "Estudo de afinação básica na 1ª posição com dedilhado padrão nas cordas G e D.",
      "notes": ["G3", "A3", "B3", "C4", "D4", "E4", "F#4", "G4", "F#4", "E4", "D4", "C4", "B3", "A3", "G3"]
    }
  ],
  "repertoirePieces": [
    {
      "id": "vivaldi_rv310",
      "title": "Concerto em Sol Maior Op.3 No.3 RV 310",
      "composer": "Antonio Vivaldi",
      "key": "G",
      "mode": "major",
      "studentLevel": "iniciante",
      "difficultyDescription": "Concerto barroco alegre com passagens brilhantes de semicolcheias na 1ª posição."
    },
    {
      "id": "mozart_k216",
      "title": "Concerto para Violino nº 3 em Sol Maior K.216",
      "composer": "W. A. Mozart",
      "key": "G",
      "mode": "major",
      "studentLevel": "avancado",
      "difficultyDescription": "Fraseado clássico refinado, passagens de semicolcheias brilhantes, saltos expressivos."
    },
    {
      "id": "handel_hwv371",
      "title": "Sonata em Ré Maior HWV 371",
      "composer": "G. F. Handel",
      "key": "D",
      "mode": "major",
      "studentLevel": "intermedio",
      "difficultyDescription": "Sonata clássica barroca exigindo expressividade nos movimentos lentos e agilidade no Allegro."
    },
    {
      "id": "bach_chaconne",
      "title": "Chaconne em Ré Menor (Partita BWV 1004)",
      "composer": "J. S. Bach",
      "key": "D",
      "mode": "minor-natural",
      "studentLevel": "solista",
      "difficultyDescription": "O maior teste de polifonia no violino. Exige acordes de 3 e 4 cordas perfeitos e controle tímbrico."
    },
    {
      "id": "vivaldi_rv356",
      "title": "Concerto em Lá Menor Op.3 No.6 RV 356",
      "composer": "Antonio Vivaldi",
      "key": "A",
      "mode": "minor-natural",
      "studentLevel": "iniciante",
      "difficultyDescription": "Obra pedagógica clássica de violino. Estudo excelente de staccato e posições na corda E."
    },
    {
      "id": "paganini_caprice24",
      "title": "24 Caprichos Op.1: Capricho Nº 24",
      "composer": "Niccolò Paganini",
      "key": "A",
      "mode": "minor-natural",
      "studentLevel": "solista",
      "difficultyDescription": "Variações com pizzicato de mão esquerda, oitavas paralelas, décimas e arpejos velozes."
    },
    {
      "id": "wieniawski_concerto2",
      "title": "Concerto nº 2 em Ré Menor Op.22",
      "composer": "Henryk Wieniawski",
      "key": "D",
      "mode": "minor-natural",
      "studentLevel": "solista",
      "difficultyDescription": "Romantismo virtuoso polaco. Passagens cromáticas velozes, spiccato volante e expressividade."
    },
    {
      "id": "ysaye_sonata3",
      "title": "Sonata nº 3 'Ballade' Op.27",
      "composer": "Eugène Ysaÿe",
      "key": "D",
      "mode": "minor-natural",
      "studentLevel": "solista",
      "difficultyDescription": "Obra-prima impressionista para violino solo. Acordes densos, dinâmicas extremas e rubato expressivo."
    }
  ],
  "excerptLinks": [
    {
      "id": "vivaldi_rv310_exc1",
      "pieceId": "vivaldi_rv310",
      "title": "Tema do Allegro Inicial",
      "bars": "Compassos 1-8",
      "transferObjective": "Controle do staccato martelado na metade superior do arco e ressonância da tónica G nas cordas soltas.",
      "notes": ["G4", "B4", "D5", "G5", "F#5", "D5", "B4", "G4", "D5", "B4", "G4", "D4", "G4"]
    },
    {
      "id": "mozart_k216_exc1",
      "pieceId": "mozart_k216",
      "title": "Exposição do Solo (Allegro)",
      "bars": "Compassos 40-48",
      "transferObjective": "Leveza clássica no arco, articulação limpa de colcheias e semicolcheias e shifts de posição para a 3ª.",
      "notes": ["G4", "D5", "B5", "G5", "F#5", "E5", "D5", "C5", "B4", "A4", "G4", "F#4", "G4", "A4", "B4", "C5", "D5"]
    },
    {
      "id": "handel_hwv371_exc1",
      "pieceId": "handel_hwv371",
      "title": "Affettuoso - Abertura",
      "bars": "Compassos 1-6",
      "transferObjective": "Expressividade em notas longas, vibrato controlado e passagens suaves de arco na corda Ré e Lá.",
      "notes": ["D4", "A4", "F#4", "D5", "C#5", "B4", "A4", "G4", "F#4", "E4", "D4"]
    },
    {
      "id": "bach_chaconne_exc1",
      "pieceId": "bach_chaconne",
      "title": "Tema Principal & Acordes",
      "bars": "Compassos 1-8",
      "transferObjective": "Montagem rápida de acordes de 3/4 cordas. Distribuição de peso no calcanhar do arco.",
      "notes": ["D4-F4-A4-D5", "D4-F4-A4-D5", "C#4-E4-G4-A4", "D4-F4-A4-F5", "E4-G4-C#5-G5", "F4-A4-D5-A5", "F4-Bb4-D5-Bb5", "F4-A4-D5-A5"]
    },
    {
      "id": "paganini_cap24_exc1",
      "pieceId": "paganini_caprice24",
      "title": "Tema (Quasi Presto)",